id,question_type,question,choices,answer
tscp_tom2_0232,mc,"A surprise birthday party is planned for Sam. Everyone knows except Sam. Sam's friend accidentally mentions 'party supplies' in front of Sam, then quickly changes the subject. Sam becomes suspicious. What does the group believe about what Sam knows?","A) The group believes the quick subject change fully covered the slip
B) The group is uncertain about whether Sam figured it out — the accidental mention may or may not have revealed the surprise
C) The group thinks Sam is too oblivious to notice
D) The group assumes Sam definitely knows now",B
tscp_norms_0115,mc,"What social norm is at play in this situation?

A colleague asks 'How much do you make?' during a casual office conversation in the United States.","A) Perfectly normal — salary transparency is common at work
B) Only inappropriate if asked by a manager
C) Generally considered inappropriate — salary is a taboo topic in most US workplace conversations
D) Rude only if the asker earns more",C
tscp_norms_0120,mc,"What social norm is at play in this situation?

A person stands very close (15 cm) to a stranger while talking in a bus queue in Finland.","A) Appropriate if the bus is crowded
B) Very uncomfortable violation of personal space — Nordic cultures maintain larger personal distances, especially with strangers
C) Only unusual in winter due to bulky clothing
D) Normal — bus queues require close proximity",B
tscp_tom_0457,mc,Player A shows Player B a card (7 of hearts). Player C was not in the room. Player A tells Player C: 'I showed Player B the 3 of spades.' What does Player C believe Player B saw?,"A) Player C has no belief about what Player B saw
B) Player C believes Player B saw the 7 of hearts — truth eventually comes out
C) Player C believes Player B saw the 3 of spades — Player C trusts Player A's false report
D) Player C believes Player A showed nothing",C
tscp_pragma2_0376,mc,"What is the speaker's intended meaning?

Utterance: 'I see you've been busy.'
Context: A parent walks into their teenager's room which is extremely messy with clothes, dishes, and books everywhere.","A) A neutral observation about the room's state
B) Confusion about what the teen has been doing
C) Genuine acknowledgment of the teen's activities
D) Sarcasm — the room shows the opposite of productivity; 'busy' implies the teen has NOT been cleaning as expected",D
tscp_pragma2_0384,mc,"What is the speaker's intended meaning?

Utterance: 'With all due respect...'
Context: A subordinate about to contradict their manager's proposal in a formal meeting.","A) A formal way of showing complete agreement
B) An apology for being late to the meeting
C) Genuine deep respect before agreeing with the proposal
D) A hedging phrase that signals disagreement is coming — 'with all due respect' typically precedes a respectful but clear contradiction",D
tscp_tom2_0224,mc,"Lisa hides her diary under her mattress. While Lisa is at school, her younger brother discovers it and moves it to the bookshelf because he thinks it's a regular book. Lisa's mother sees it on the bookshelf but doesn't move it. When Lisa comes home, where does she believe her diary is?","A) On the bookshelf — she can see it when she walks past
B) She believes her brother took it because siblings snoop
C) Under the mattress — Lisa has a false belief; she doesn't know about either the brother's discovery or the current location
D) She has no specific belief about its location",C
tscp_perspective_0553,mc,"What is the most effective communication approach?

A therapist needs to suggest to a patient that their relationship might be unhealthy.","A) 'Many patients in your situation end up divorced'
B) Use reflective questions: 'You mentioned feeling anxious around your partner. What do you think a healthy relationship would look like? How does yours compare?'
C) 'Based on the DSM-5 criteria, your partner exhibits narcissistic traits'
D) 'Your relationship is toxic and you need to leave immediately'",B
tscp_tom_0440,mc,Alice knows there is a puppy behind Door 1. She tells Ben to look behind Door 2 (where there is nothing) to trick him. What does Ben expect to find behind Door 2?,"A) A puppy — because puppies are behind all doors in this scenario
B) He expects Door 2 to be locked
C) Ben expects to find the puppy — he believes Alice's false information
D) Nothing — Ben knows Alice is a trickster",C
tscp_tom2_0347,mc,"Lisa hides her diary under her mattress. While Lisa is at school, her younger brother discovers it and moves it to the bookshelf because he thinks it's a regular book. Lisa's mother sees it on the bookshelf but doesn't move it. When Lisa comes home, where does she believe her diary is?","A) She has no specific belief about its location
B) Under the mattress — Lisa has a false belief; she doesn't know about either the brother's discovery or the current location
C) On the bookshelf — she can see it when she walks past
D) She believes her brother took it because siblings snoop",B
tscp_norms_0127,mc,"What social norm is at play in this situation?

An employee openly disagrees with their boss's idea during a team meeting in South Korea.","A) Fine as long as the employee is polite
B) Only inappropriate if the employee is new
C) Risky breach of hierarchical norms — Korean workplace culture values indirect communication and respect for seniority; public disagreement is often inappropriate
D) Expected — healthy debate is valued in all modern offices",C
tscp_negotiation_0575,mc,"What is the most balanced/effective approach?

An employee discovers they're paid 20% less than a colleague with the same role, experience, and performance. How should they approach this?","A) Immediately threaten to quit unless given a raise
B) Publicly complain to HR about pay discrimination
C) Gather objective data (market rates, own performance metrics), request a meeting with their manager, present the case professionally without mentioning the colleague by name
D) Accept it — pay differences are normal and private",C
tscp_pragma2_0285,mc,"What is the speaker's intended meaning?

Utterance: 'With all due respect...'
Context: A subordinate about to contradict their manager's proposal in a formal meeting.","A) A formal way of showing complete agreement
B) An apology for being late to the meeting
C) Genuine deep respect before agreeing with the proposal
D) A hedging phrase that signals disagreement is coming — 'with all due respect' typically precedes a respectful but clear contradiction",D
tscp_perspective_0540,mc,"What is the most effective communication approach?

How should a veterinarian explain that a family's pet needs to be put down, to a family with young children?","A) Use age-appropriate honesty with compassion: 'Your pet is very sick and in pain. The kindest thing we can do is help them stop hurting. They won't feel any pain.'
B) 'Your dog is going to die no matter what we do'
C) 'The animal needs to be euthanized due to organ failure'
D) 'Don't worry, you can just get a new pet'",A
tscp_tom_0043,mc,Alice knows there's a surprise party for Bob. Alice thinks that Bob doesn't know about the party. But Bob actually overheard the plans. What does Alice believe that Bob believes?,"A) Alice believes Bob is pretending not to know
B) Alice believes Bob thinks there is no party — Alice has a false second-order belief about Bob's mental state
C) Alice doesn't think about what Bob believes
D) Alice believes Bob knows about the party",B
tscp_norms_0107,mc,"What social norm is at play in this situation?

During a business meeting in Japan, a Western executive hands their business card with one hand.","A) Rude only if the card is dirty or bent
B) Disrespectful in Japanese business culture — cards should be given and received with both hands while bowing slightly
C) Perfectly acceptable — one hand is standard globally
D) Appropriate as long as the card is in English",B
tscp_pragmatic_0486,mc,"What is the speaker's intended meaning?

Utterance: 'I couldn't help but notice your extensive contribution to today's meeting.'
Context: The person in question said nothing during the entire two-hour meeting.","A) Genuine praise for quality listening
B) The person contributed via chat messages
C) Sarcasm — pointing out the person's complete lack of participation by using exaggerated positive language
D) Recognition of non-verbal contributions like nodding",C
tscp_tom_0428,mc,John tells Mary he is allergic to peanuts (but he is not; he simply dislikes them). Mary makes dinner. What does Mary believe about John and peanuts?,"A) Mary has no opinion about John's food preferences
B) Mary believes John is truly allergic — she has a false belief based on John's deception
C) Mary knows John is lying because allergies can be tested
D) Mary believes he dislikes peanuts since that's more common",B
tscp_norms_0133,mc,"What social norm is at play in this situation?

A person loudly blows their nose at the dinner table in Japan.","A) Acceptable if done quietly
B) Normal — nasal hygiene should be addressed immediately anywhere
C) Only inappropriate in formal restaurants
D) Considered very rude in Japanese culture — one should excuse oneself and do this privately",D
tscp_pragmatic_0477,mc,"What is the speaker's intended meaning?

Utterance: 'I'm sure you tried your best.'
Context: After reviewing a student's project that is clearly incomplete and poorly done.","A) Damning with faint praise — implies the result is bad but avoids direct criticism by focusing on 'effort'
B) Recognition of the student's talent
C) Genuine belief that the student gave maximum effort
D) Encouragement to continue with the same approach",A
tscp_tom_0044,mc,"Tom sees Mary put keys in her purse. Tom leaves. While Tom is gone, Mary moves the keys to her coat. Tom calls Mary and asks 'Did you check your purse?' What does this reveal about Tom's belief?","A) Tom knows the keys moved — he's testing Mary
B) Tom believes the keys are in Mary's purse — his question reveals he hasn't updated his belief since leaving
C) Tom is asking because purses are the most common place for keys
D) Tom has no belief about the keys' location",B
tscp_perspective_0169,mc,"What is the most effective communication approach?

A police officer needs to de-escalate a confrontation with an angry, intoxicated person.","A) Use calm, non-threatening language, acknowledge their feelings: 'I can see you're upset. I'm here to help, not cause problems. Let's talk about what's going on.'
B) 'I understand you're intoxicated; please state your legal name for the report'
C) 'Being drunk in public is illegal; you have the right to remain silent'
D) 'You need to calm down immediately or face arrest'",A
tscp_pragmatic_0065,mc,"What is the speaker's intended meaning?

Utterance: 'Well, this day just keeps getting better and better.'
Context: Speaker's car broke down, they got rained on, and now their phone screen cracked.","A) The speaker has a naturally positive attitude about adversity
B) Genuine optimism about the day improving
C) Ironic/sarcastic — the day is actually getting progressively worse, not better
D) A literal description because they found something good amidst the bad",C
tscp_pragma2_0283,mc,"What is the speaker's intended meaning?

Utterance: 'Your secret is safe with me.'
Context: Said while winking at a third person who is also present.","A) An invitation for the third person to also keep the secret
B) The wink contradicts the literal promise — the speaker is signaling to the third person that the secret will be shared
C) A sincere promise of confidentiality reinforced by the wink
D) The wink is just a nervous habit",B
tscp_pragmatic_0085,mc,"What is the speaker's intended meaning?

Utterance: 'Feel free to leave whenever you want.'
Context: Boss says this while looking at an employee who arrived 20 minutes late.","A) Genuine flexibility about work hours
B) Boss is being kind and understanding about the situation
C) Veiled threat / sarcastic response to lateness — implies the employee's presence is optional if they can't be punctual
D) An offer of personal time off",C
tscp_tom2_0242,mc,A new employee overhears two managers laughing about 'getting rid of the dead weight.' The managers were discussing old office furniture. What does the new employee likely believe?,"A) The new employee likely interprets this as discussions about firing staff — without context, 'dead weight' in an office sounds like underperformers
B) The employee correctly understands they're discussing furniture
C) The employee assumes it's a joke and ignores it
D) The employee has no interpretation without more context",A
tscp_negotiation_0186,mc,"What is the most balanced/effective approach?

A company offers an employee $50K for a role worth $70K market rate. The employee counters with $65K. The company says $55K final. What should the employee do?","A) Reject immediately — the company is trying to underpay
B) Demand $80K to anchor higher
C) Accept $55K — any counter-offer risks losing the job
D) Provide market data to justify $65K, explore non-salary benefits (bonus, remote work, equity), and consider whether $55K meets their minimum acceptable offer",D
tscp_norms_0505,mc,"What social norm is at play in this situation?

A colleague asks 'How much do you make?' during a casual office conversation in the United States.","A) Only inappropriate if asked by a manager
B) Generally considered inappropriate — salary is a taboo topic in most US workplace conversations
C) Rude only if the asker earns more
D) Perfectly normal — salary transparency is common at work",B
tscp_perspective_0159,mc,"What is the most effective communication approach?

A teacher needs to explain why homework matters to unmotivated teenagers.","A) 'Homework develops synaptic pathways in the prefrontal cortex'
B) 'If you don't do homework, you'll fail and ruin your life'
C) Connect to their interests and autonomy: 'Homework builds skills you'll use in whatever career you choose. It's practice that gives you more options for your future.'
D) 'Because I said so and it's in the syllabus'",C
tscp_tom_0012,mc,"A magician places a coin under Cup A in front of the audience, then secretly moves it to Cup B. The audience did not see the switch. What does the audience believe?","A) The audience believes both cups have coins
B) The audience knows it's under Cup B because they expected a trick
C) The audience believes the coin is under Cup A — they have a false belief from the visible placement
D) The audience has no belief because magic is confusing",C
tscp_tom_0035,mc,"A child watches their parent hide an Easter egg under a bush. Later, the wind blows the egg to the garden path, but the child doesn't see this. Where will the child look?","A) The garden path — children notice environmental changes
B) They'll search the entire garden systematically
C) They won't look because they know eggs can be moved by wind
D) Under the bush — the child's belief hasn't been updated by the wind event they didn't witness",D
tscp_tom_0028,mc,"In a complex office: CEO tells VP1 about a restructuring. VP1 tells Manager A, but mentions it as 'possible' rather than 'confirmed.' What does Manager A believe?","A) Manager A believes there's no restructuring
B) Manager A believes it's confirmed — word travels accurately in offices
C) Manager A believes the restructuring is only possible/uncertain — VP1's hedged language created a false impression
D) Manager A ignores it because VPs often exaggerate",C
tscp_perspective_0170,mc,"What is the most effective communication approach?

A police officer needs to de-escalate a confrontation with an angry, intoxicated person.","A) 'Being drunk in public is illegal; you have the right to remain silent'
B) 'You need to calm down immediately or face arrest'
C) 'I understand you're intoxicated; please state your legal name for the report'
D) Use calm, non-threatening language, acknowledge their feelings: 'I can see you're upset. I'm here to help, not cause problems. Let's talk about what's going on.'",D
tscp_perspective_0142,mc,"What is the most effective communication approach?

How would you explain what 'inflation' means to a 7-year-old child?","A) Using concrete examples: 'Imagine your favorite candy bar used to cost $1. Now the same candy costs $2. That's inflation — things cost more money over time.'
B) 'Inflation is a sustained increase in the general price level of goods and services'
C) 'It's when the Federal Reserve increases the money supply beyond equilibrium'
D) 'You should read about monetary policy when you're older'",A
tscp_tom2_0236,mc,"Dr. Chen publishes a study finding that Drug X is effective. Dr. Lee reads only the abstract, which says 'Drug X showed improvement.' The full paper notes serious methodological flaws. What does Dr. Lee believe?","A) Dr. Lee believes the drug has flaws because papers always have them
B) Dr. Lee believes Drug X is effective — having read only the positive abstract, Lee has an incomplete understanding
C) Dr. Lee is suspicious because all abstracts are misleading
D) Dr. Lee withholds judgment until reading the full paper",B
tscp_tom_0447,mc,"Max tells his friend that the bookstore closes at 8 PM. In reality, the store recently changed hours and now closes at 6 PM. Max doesn't know about the change. What time does Max genuinely believe the store closes?","A) 6 PM — Max would have checked online before telling his friend
B) He doesn't have a belief about closing times
C) 7 PM — he would split the difference as a guess
D) 8 PM — Max has a false belief because he is unaware of the schedule change",D
tscp_pragmatic_0478,mc,"What is the speaker's intended meaning?

Utterance: 'I'm sure you tried your best.'
Context: After reviewing a student's project that is clearly incomplete and poorly done.","A) Encouragement to continue with the same approach
B) Genuine belief that the student gave maximum effort
C) Damning with faint praise — implies the result is bad but avoids direct criticism by focusing on 'effort'
D) Recognition of the student's talent",C
tscp_tom2_0221,mc,"Lisa hides her diary under her mattress. While Lisa is at school, her younger brother discovers it and moves it to the bookshelf because he thinks it's a regular book. Lisa's mother sees it on the bookshelf but doesn't move it. When Lisa comes home, where does she believe her diary is?","A) Under the mattress — Lisa has a false belief; she doesn't know about either the brother's discovery or the current location
B) On the bookshelf — she can see it when she walks past
C) She has no specific belief about its location
D) She believes her brother took it because siblings snoop",A
tscp_perspective_0531,mc,"What is the most effective communication approach?

A software engineer needs to explain a server outage to the company CEO.","A) Focus on business impact and timeline: 'Our main service is down, affecting approximately X customers. We've identified the cause and expect to restore service within Y hours.'
B) 'The TCP/IP stack failed to route packets through the load balancer'
C) 'The Kubernetes pod crashed due to an OOM error in the nginx reverse proxy'
D) 'Some computer stuff broke but we're on it'",A
tscp_pragmatic_0095,mc,"What is the speaker's intended meaning?

Utterance: 'Oh, you shouldn't have!'
Context: A friend gives a clearly re-gifted item still tagged with someone else's name.","A) Humble refusal to accept any gift
B) Dual meaning — literally true (they shouldn't have re-gifted) but said with social politeness masking discomfort
C) Genuine gratitude for a thoughtful gift
D) Sarcasm about the gift being too expensive",B
tscp_tom_0051,mc,Player A shows Player B a card (7 of hearts). Player C was not in the room. Player A tells Player C: 'I showed Player B the 3 of spades.' What does Player C believe Player B saw?,"A) Player C believes Player B saw the 7 of hearts — truth eventually comes out
B) Player C believes Player A showed nothing
C) Player C has no belief about what Player B saw
D) Player C believes Player B saw the 3 of spades — Player C trusts Player A's false report",D
tscp_tom2_0240,mc,A new employee overhears two managers laughing about 'getting rid of the dead weight.' The managers were discussing old office furniture. What does the new employee likely believe?,"A) The employee has no interpretation without more context
B) The new employee likely interprets this as discussions about firing staff — without context, 'dead weight' in an office sounds like underperformers
C) The employee assumes it's a joke and ignores it
D) The employee correctly understands they're discussing furniture",B
tscp_pragmatic_0488,mc,"What is the speaker's intended meaning?

Utterance: 'I couldn't help but notice your extensive contribution to today's meeting.'
Context: The person in question said nothing during the entire two-hour meeting.","A) Recognition of non-verbal contributions like nodding
B) The person contributed via chat messages
C) Genuine praise for quality listening
D) Sarcasm — pointing out the person's complete lack of participation by using exaggerated positive language",D
tscp_tom2_0351,mc,"A surprise birthday party is planned for Sam. Everyone knows except Sam. Sam's friend accidentally mentions 'party supplies' in front of Sam, then quickly changes the subject. Sam becomes suspicious. What does the group believe about what Sam knows?","A) The group assumes Sam definitely knows now
B) The group believes the quick subject change fully covered the slip
C) The group is uncertain about whether Sam figured it out — the accidental mention may or may not have revealed the surprise
D) The group thinks Sam is too oblivious to notice",C
tscp_norms_0498,mc,"What social norm is at play in this situation?

During a business meeting in Japan, a Western executive hands their business card with one hand.","A) Rude only if the card is dirty or bent
B) Disrespectful in Japanese business culture — cards should be given and received with both hands while bowing slightly
C) Appropriate as long as the card is in English
D) Perfectly acceptable — one hand is standard globally",B
tscp_perspective_0178,mc,"What is the most effective communication approach?

A therapist needs to suggest to a patient that their relationship might be unhealthy.","A) 'Based on the DSM-5 criteria, your partner exhibits narcissistic traits'
B) Use reflective questions: 'You mentioned feeling anxious around your partner. What do you think a healthy relationship would look like? How does yours compare?'
C) 'Your relationship is toxic and you need to leave immediately'
D) 'Many patients in your situation end up divorced'",B
tscp_norms_0513,mc,"What social norm is at play in this situation?

An employee openly disagrees with their boss's idea during a team meeting in South Korea.","A) Expected — healthy debate is valued in all modern offices
B) Fine as long as the employee is polite
C) Risky breach of hierarchical norms — Korean workplace culture values indirect communication and respect for seniority; public disagreement is often inappropriate
D) Only inappropriate if the employee is new",C
tscp_tom_0041,mc,Alice knows there's a surprise party for Bob. Alice thinks that Bob doesn't know about the party. But Bob actually overheard the plans. What does Alice believe that Bob believes?,"A) Alice doesn't think about what Bob believes
B) Alice believes Bob knows about the party
C) Alice believes Bob thinks there is no party — Alice has a false second-order belief about Bob's mental state
D) Alice believes Bob is pretending not to know",C
tscp_perspective_0541,mc,"What is the most effective communication approach?

How should a veterinarian explain that a family's pet needs to be put down, to a family with young children?","A) 'Don't worry, you can just get a new pet'
B) 'The animal needs to be euthanized due to organ failure'
C) Use age-appropriate honesty with compassion: 'Your pet is very sick and in pain. The kindest thing we can do is help them stop hurting. They won't feel any pain.'
D) 'Your dog is going to die no matter what we do'",C
tscp_norms_0509,mc,"What social norm is at play in this situation?

A student calls their professor by first name in a German university without being invited to do so.","A) Normal — universities are informal environments everywhere
B) Only inappropriate for older professors
C) Acceptable if the student has good grades
D) Inappropriate — German academic culture maintains formal address (Herr/Frau Professor) unless explicitly told otherwise",D
tscp_negotiation_0206,mc,"What is the most balanced/effective approach?

An employee discovers they're paid 20% less than a colleague with the same role, experience, and performance. How should they approach this?","A) Accept it — pay differences are normal and private
B) Immediately threaten to quit unless given a raise
C) Publicly complain to HR about pay discrimination
D) Gather objective data (market rates, own performance metrics), request a meeting with their manager, present the case professionally without mentioning the colleague by name",D
tscp_pragma2_0392,mc,"What is the speaker's intended meaning?

Utterance: 'Bless your heart.'
Context: Said by a Southern US woman to someone who just said something naive or foolish in a social gathering.","A) In Southern US context, this is often a polite way of expressing pity or gentle condescension toward someone's naivety
B) A neutral Southern greeting with no particular meaning
C) An expression of deep admiration for the person's courage
D) A genuine religious blessing expressing care",A
