id,question_type,question,choices,answer
tscp_nested_tom_0020,mc,"Hal is confessing to a crime he did not commit in order to protect Ian. Ian knows Hal is innocent. Ian does not know that Judy, the investigator, has already obtained evidence proving Hal is innocent. Judy knows Hal is lying in his confession. What does Ian believe Judy believes about Hal's guilt?","A) Ian believes Judy thinks Hal is guilty based on the confession
B) Ian believes Judy suspects the confession is false
C) Ian believes Judy has proof Hal is innocent
D) Ian does not have enough information to know what Judy believes",A
tscp_nested_tom_0021,mc,"Kate told Leo that Mia said she did not submit the report. Leo knows this is false — he watched Mia submit the report. But Leo does not know that Kate fabricated the claim (he thinks Kate was misinformed, not lying). Kate does not know Leo saw Mia submit the report. What does Kate believe Leo now believes about whether Mia submitted the report?","A) Kate believes Leo now believes Mia did not submit the report
B) Kate believes Leo still believes Mia submitted the report
C) Kate believes Leo is uncertain whether Mia submitted the report
D) Kate believes Leo will verify directly with Mia",A
tscp_nested_tom_0022,mc,"Ned is aware that Olive is pretending to like his artwork to spare his feelings. Ned pretends to be convinced by Olive's praise. Olive, seeing Ned's reaction, believes her pretense succeeded. What does Olive believe about the current situation?","A) Olive believes Ned genuinely thinks she likes the artwork
B) Olive believes Ned knows she is pretending but is playing along
C) Olive believes Ned is also pretending to be convinced
D) Olive is uncertain whether Ned was fooled or not",A
tscp_nested_tom_0023,mc,"Pete tells Quincy a secret, trusting him not to tell Rose. Quincy tells Rose the secret but asks Rose to pretend she does not know when she sees Pete. Rose pretends successfully with Pete, who then tells Quincy that Rose still doesn't know. What does Pete believe Quincy believes about whether Rose knows the secret?","A) Pete believes Quincy thinks Rose does not know the secret
B) Pete believes Quincy knows Rose knows the secret, since Quincy told her
C) Pete believes Quincy is unsure whether Rose found out
D) Pete believes Quincy thinks Pete suspects Rose knows",A
tscp_nested_tom_0024,mc,"Rita is negotiating. She wants outcome X but signals she wants outcome Y, hoping the other party (Steve) will concede Y to her. Steve, who actually wants Y, sees through Rita's strategy and suspects she really wants X. Steve decides to offer X to Rita while pretending he prefers X himself, to make Rita think she won a concession on X. Rita, receiving Steve's offer of X, believes Steve fell for her misdirection. Who actually got what they wanted?","A) Both Rita and Steve got what they wanted
B) Only Rita got what she wanted; Steve had to give up X
C) Only Steve got what he wanted; Rita's strategy backfired
D) Neither got what they wanted; both were strategically outmaneuvered",A
tscp_nested_tom_0025,mc,"Tim believes Uma is angry at him. Uma is not angry but noticed Tim thinks she is, so she acts normally to reassure him. Tim, seeing Uma act normally, now thinks Uma has forgiven him for whatever upset her. What false belief does Tim hold at the end of this scenario?","A) Tim falsely believes Uma was originally angry at him
B) Tim falsely believes Uma is still angry
C) Tim falsely believes Uma noticed his concern
D) Tim falsely believes Uma has forgiven him for something that upset her",D
tscp_nested_tom_0026,mc,"Vera whispered to Walt that Xander told her that Yolanda distrusts Walt. In fact, Xander never said this — Vera invented it. Walt confronted Xander, who denied saying it but Walt thought Xander was covering up. Yolanda actually does distrust Walt, though she never told Xander or Vera. Regarding Yolanda's distrust of Walt — which agents hold an accidentally true belief and which hold a false belief?","A) Walt accidentally holds a true belief (Yolanda distrusts him); Vera holds a false belief about the source (Xander said it)
B) Vera holds a true belief; Walt holds a false belief about Yolanda's feelings
C) Both Walt and Vera hold false beliefs about Yolanda's feelings
D) Xander accidentally holds a true belief; everyone else holds false beliefs",A
tscp_nested_tom_0027,mc,Alice is aware that Bob is aware that Carol is unaware that they are both watching her. Alice thinks Bob does not know she is also watching Carol. Bob actually knows Alice is also watching but is pretending not to. What is the correct characterization of this situation regarding Alice's belief about mutual awareness?,"A) Alice believes she and Bob share mutual awareness of watching Carol secretly
B) Alice believes only Bob is watching Carol and she is watching Bob watch Carol
C) Alice believes she is watching Carol secretly, unbeknownst to Bob
D) Alice believes all three are mutually aware of each other",C
tscp_nested_tom_0028,mc,"Dan told Eve he was happy, but he was sad. Eve could tell Dan was sad but told Frank that Dan seemed happy, to protect Dan's privacy. Frank told Dan that Eve said he seemed happy. Dan, not knowing Eve saw through his pretense, now believes his act was convincing. What false belief does Dan hold as a result of this chain?","A) Dan falsely believes Eve thought he was happy
B) Dan falsely believes Frank knows he was sad
C) Dan falsely believes Eve confided his sadness to Frank
D) Dan falsely believes he successfully deceived everyone",A
tscp_nested_tom_0029,mc,"Grace tells Han a plan, knowing Han will tell Iris, knowing Iris will tell Jin, who will tell Grace everything she hears. Grace wants to know if Iris will modify the plan before passing it along. Han tells Iris accurately. Iris modifies the plan slightly before telling Jin. Jin tells Grace the modified version. What is the most sophisticated conclusion Grace can draw from this information?","A) Grace confirms that Han can be trusted to pass information accurately
B) Grace concludes Iris altered the plan, but she cannot determine whether Han or Iris made the modification
C) Grace concludes Iris altered the plan, since she can compare what she told Han with what Jin relayed, and Han is a known accurate relay
D) Grace concludes Jin altered the plan to avoid conflict",C
tscp_nested_tom_0030,mc,"Karen is aware that Luis is aware that she is performing confidence she does not feel. Luis is aware that Karen knows he can see through her. Karen is NOT aware that Luis knows she knows he can see through her. If Luis says, 'You seem really confident about this,' what is he most plausibly communicating at the level he is actually operating at?","A) Luis is genuinely deceived and thinks Karen is confident
B) Luis is acknowledging Karen's performance while playing along, since he knows she knows he sees it
C) Luis is subtly signaling to Karen that he can see through her performance, hoping she will drop it
D) Luis is being ironic, since both know Karen is performing, but Karen does not know Luis knows this",C
tscp_pragma_trap_0001,mc,"A job interviewer says to a candidate: 'We have many strong applicants.' The candidate concludes the interviewer means they will not get the job. Which interpretation of the statement is most defensible, given only this information?","A) The statement is a polite rejection — a scalar implicature meaning the candidate is not the strongest
B) The statement is literally true and the interviewer is providing factual context with no implied negative judgment of this candidate
C) The statement is encouraging — the interviewer is signaling the candidate is among the strong applicants
D) The statement is ambiguous and cannot be interpreted without more context",D
tscp_pragma_trap_0002,mc,"In a Korean workplace context, a senior employee says to a junior colleague, 'You worked hard today.' A Western pragmatics framework would interpret this as face-saving criticism. What is the correct pragmatic interpretation in the original cultural context?","A) The sentence is a genuine, face-value compliment common in Korean workplace culture
B) The sentence is sarcastic and means the junior employee underperformed
C) The sentence implies the junior employee does not usually work hard
D) The sentence is a formulaic closing statement with no evaluative content",A
tscp_pragma_trap_0003,mc,"After dinner, the host says, 'There's more food if you want it.' The guest is still hungry. In a Japanese cultural context, what is the pragmatically appropriate response if the guest does want more food?","A) Decline politely once, then accept if the host offers again — social scripts often require initial refusal before acceptance
B) Immediately accept — the host's offer is a direct invitation and declining would be rude
C) Decline firmly — accepting a second helping is considered greedy in Japanese culture
D) Ask how much remains before deciding, to avoid taking more than is available",A
tscp_pragma_trap_0004,mc,A doctor tells a patient: 'Some patients with your condition recover fully.' The standard Gricean scalar implicature analysis would lead the patient to conclude what?,"A) That most patients with this condition recover fully
B) That the doctor believes this patient will not recover fully
C) That not all patients with this condition recover fully
D) That the patient's case is unusual and merits attention",C
tscp_pragma_trap_0005,mc,"Maria says to her colleague, 'I wouldn't say your presentation was boring.' The most sophisticated pragmatic analysis of this utterance, taking into account litotes and conversational norms, yields what interpretation?","A) The presentation was boring — the litotes softens a negative evaluation
B) The presentation was not boring — the literal meaning, using litotes as understatement for 'interesting'
C) Maria is being sarcastic; the presentation was obviously boring
D) The utterance is genuinely ambiguous between a mild compliment and a softened criticism",D
tscp_pragma_trap_0006,mc,"A British colleague says, 'That's quite an interesting approach.' In British English understatement conventions, this most commonly signals what?","A) Genuine strong enthusiasm — 'quite' is an intensifier in British English
B) Polite disapproval or doubt — 'quite interesting' often undercuts the apparent praise
C) Neutral factual description with no evaluative valence
D) Sarcasm — the approach is considered uninteresting",B
tscp_pragma_trap_0007,mc,"A speaker says: 'Can you pass the salt?' at a dinner table. A strict literal interpretation treats this as a yes/no ability question. In practice, almost all competent speakers treat it as a request. Which claim about this utterance is most accurate from a linguistic pragmatics standpoint?","A) The utterance is an indirect speech act; calling it a question is technically incorrect
B) The utterance is only a request — the literal reading is pragmatically dead and irrelevant
C) The utterance is an indirect speech act only when the speaker lacks the ability to reach the salt
D) The utterance is conventionalized as a request, but it retains its interrogative form and thus both interpretations are simultaneously active for a competent speaker",D
tscp_pragma_trap_0008,mc,"Someone texts a friend: 'Sure, I'd love to come to your party.' The friend interprets this as enthusiastic acceptance. What crucial factor does the friend's interpretation fail to account for?","A) 'Sure' often functions as a low-commitment agreement marker, and the utterance may indicate reluctant acceptance rather than enthusiasm
B) Text messages lack prosodic cues that would confirm sincerity
C) 'Love to' is a hyperbolic expression and thus the enthusiasm is certainly feigned
D) Both A and B are legitimate concerns that undermine the enthusiastic interpretation",D
tscp_pragma_trap_0009,mc,"In an argument, Person A says, 'I never said you were wrong.' Person B interprets this as an admission that Person A implied they were wrong without saying it. What is the correct pragmatic analysis of Person A's statement?","A) Person B's inference is correct — the denial of the explicit triggers an implicature of the implicit
B) Person A is using stress on 'said' to implicate something nonverbal was communicated
C) Person A's statement is ambiguous — it could be a genuine denial, a stress-implication, or a reminder that no wrong-claim was made
D) Person A is simply denying the claim to avoid confrontation with no deeper implicature",C
tscp_pragma_trap_0010,mc,"A professor writes in a student's reference letter: 'This student always came to class on time and never disrupted other students.' By the Gricean maxim of quantity, what inference is a reader most likely to draw?","A) The professor highly recommends the student because punctuality and conduct are important
B) The professor is describing the minimum acceptable behavior, implying the student has no noteworthy intellectual or academic strengths
C) The professor is being diplomatic about the student's disruptive tendencies in the past
D) The letter is incomplete and the professor intends to add more content",B
tscp_pragma_trap_0011,mc,"At an academic job talk, the chair says after the candidate's presentation: 'We'll be in touch.' Is this statement best analyzed as a polite rejection, a genuine commitment, or something else?","A) It is a polite rejection — a standard formulaic way of saying no without confrontation
B) It is a genuine commitment to contact the candidate, positive or negative
C) It is genuinely ambiguous — without additional context (tone, norms of this institution, candidate's assessment), the interpretation cannot be determined
D) It is a positive signal — candidates who are rejected are usually told immediately",C
tscp_pragma_trap_0012,mc,A Mandarin speaker says to a guest: '你吃饭了吗？' (literally: 'Have you eaten?') upon seeing them. A Western pragmatics analysis might treat this as a question about hunger. What is the pragmatically appropriate interpretation in the original cultural context?,"A) The speaker is literally asking whether the guest has eaten and intends to offer food if not
B) The phrase is a conventional greeting equivalent to 'How are you?' with no literal inquiry about eating
C) The speaker is being rude by highlighting the guest's need for food
D) The phrase has both a greeting function and a genuine inquiry function, making interpretation dependent on the specific relationship and context",D
tscp_pragma_trap_0013,mc,"A manager tells an employee, 'Feel free to take a longer lunch today.' The employee does not typically take long lunches. What is the most pragmatically complete interpretation of this statement?","A) It is a sincere permission grant — the manager wants the employee to relax
B) It is a subtle reproach — the employee has been working too slowly and needs to speed up
C) It could be sincere permission, a reward, a hint about workload, or small talk — context is needed to disambiguate
D) It is an indirect way of telling the employee their presence is not needed in the office for a while",C
tscp_pragma_trap_0014,mc,"During a heated discussion, someone says: 'I am NOT angry!' while slamming a fist on the table. The 'obvious' interpretation is that the person is angry and denying it. Which analysis is most epistemically rigorous?","A) The person is definitely angry — the nonverbal behavior outweighs the verbal denial
B) The person might be frustrated (not angry), which they accurately label as 'not angry,' and the table-slam expresses frustration
C) The statement is straightforwardly false — anyone slamming a fist is by definition angry
D) We cannot determine the person's emotional state from this description alone; both A and B remain live possibilities",D
tscp_pragma_trap_0015,mc,"In an email, a colleague writes: 'As per my last email...' Internet culture widely treats this phrase as passive-aggressive. What is the most accurate pragmatic analysis?","A) The phrase is universally passive-aggressive — its internet connotation has replaced its literal function
B) The phrase has acquired a secondary passive-aggressive connotation in many professional contexts, but its literal use as a reference remains valid, and interpreting any instance as passive-aggressive requires additional contextual evidence
C) The phrase is always literal — passive-aggressive interpretations are a social media overreaction
D) Whether passive-aggressive or not, the phrase always implies the sender thinks the recipient failed to read the original email",B
tscp_pragma_trap_0016,mc,Person A asks: 'Do you know what time it is?' Person B responds: 'Yes.' and says nothing further. Most listeners judge B's response as uncooperative. Under what precise pragmatic principle does B's response fail?,"A) The maxim of quantity — B's response is less informative than required by the context of the question
B) The maxim of quality — B's response may be false
C) The maxim of manner — B's response is ambiguous
D) The maxim of relation — B's response is irrelevant to A's underlying need",A
tscp_pragma_trap_0017,mc,A guest at a party compliments the host: 'This food is incredibly unique.' The host is pleased by this compliment. Is the host's interpretation warranted?,"A) Yes — 'incredibly unique' is an enthusiastic compliment
B) No — 'unique' technically means 'one of a kind' and cannot be intensified by 'incredibly,' suggesting the compliment is grammatically incoherent
C) Possibly not — 'unique' can be a face-saving substitute for 'unusual' or 'strange,' making this a potentially ambiguous compliment
D) No — the guest is being sarcastic, as no polite guest would actually call food 'unique'",C
tscp_pragma_trap_0018,mc,A therapist says to a client: 'That's one way to look at it.' The client interprets this as the therapist validating their perspective. What is the most accurate pragmatic analysis?,"A) The therapist is validating the client's perspective and agreeing with it
B) The therapist is using a hedge that signals acknowledgment without endorsement and subtly implies other interpretations exist
C) The therapist is being sarcastic and disagrees with the client
D) The statement is a filler phrase with no evaluative content in therapeutic contexts",B
tscp_pragma_trap_0019,mc,An art critic writes: 'This painter is certainly ambitious.' The painter is thrilled. Should the painter be?,"A) Yes — ambition is universally praised in the arts
B) Not necessarily — in critical discourse, 'ambitious' often serves as a hedged way to say a work exceeded its creator's grasp, i.e., a veiled criticism
C) Yes — the word 'certainly' signals the critic's confident endorsement
D) No — critics only use 'ambitious' to describe failures",B
tscp_pragma_trap_0020,mc,"In a negotiation, one party says, 'We could consider moving on that point.' The other party treats this as a concession. Is this interpretation justified?","A) Yes — 'could consider' indicates willingness to move
B) Yes — in negotiation contexts, any non-refusal is treated as movement
C) It depends on whether 'that point' refers to a major or minor issue in the negotiation
D) No — 'could consider' is maximally hedged and indicates only the possibility of thinking about moving, not an actual concession",D
tscp_pragma_trap_0021,mc,"Someone says, 'I could care less,' when they mean they do not care. Pragmatically, what do most listeners understand?","A) Listeners understand the speaker cares somewhat, since 'could care less' literally implies some residual care
B) Listeners understand the speaker means they could not care less, interpreting the expression as a fixed idiom regardless of its literal meaning
C) Listeners are genuinely confused by the expression
D) Listeners take the literal meaning and conclude the speaker cares about the topic",B
tscp_pragma_trap_0022,mc,"A restaurant server says: 'Everything on our menu is excellent.' A customer infers this means they should order anything and it will be good. By Gricean analysis, what is the issue with the customer's inference?","A) The claim violates the maxim of quality — servers are biased toward promoting all items, so the statement is likely an exaggeration
B) The claim violates the maxim of quantity — if everything were truly equally excellent, there would be no point in saying it
C) There is no issue — the server's statement is a reasonable factual claim
D) Both A and B capture issues with the server's statement, making the customer's inference doubly unwarranted",D
tscp_pragma_trap_0023,mc,"In Japanese business culture, if a client says 'muzukashii desu ne' (roughly: 'that's difficult/challenging, isn't it') in response to a business proposal, what is the pragmatically correct interpretation for a non-Japanese business partner?","A) The client is acknowledging the proposal will require effort but agrees to proceed
B) The client is likely declining or expressing serious reservations without using direct refusal
C) The client is asking for a modified proposal with fewer challenges
D) The client is using a common expression of empathy with no evaluative content about the proposal",B
tscp_pragma_trap_0024,mc,A student asks a professor: 'Is there any chance I could get an extension on the paper?' The professor responds: 'Extensions are generally not given in this course.' What is the pragmatically most accurate characterization of the professor's response?,"A) The professor has denied the request
B) The professor has avoided directly denying the request — 'generally' leaves open the possibility of an exception
C) The professor has implicitly granted the extension by not refusing it explicitly
D) The professor's response is genuinely ambiguous between a denial and an opening for negotiation",D
tscp_pragma_trap_0025,mc,"Someone says, 'Not bad,' in response to a meal they cooked themselves. They are praised by a guest who says, 'Modest as always!' Is the guest's interpretation of 'not bad' as false modesty warranted?","A) Yes — saying 'not bad' about one's own cooking is a classic self-deprecatory understatement
B) Not necessarily — the cook may genuinely evaluate the meal as mediocre, making 'not bad' an accurate but lukewarm assessment
C) No — 'not bad' is never genuine self-criticism when applied to one's own work
D) The guest's interpretation depends on the cook's track record, which is not provided",B
tscp_pragma_trap_0026,mc,"A politician responds to a question about a scandal by saying, 'I stand by everything I've ever said publicly.' What implicature is most strongly generated by this statement?","A) The politician is asserting innocence and has nothing to hide
B) The politician is implying that what they have said privately may differ from their public statements
C) The politician is deflecting the question with a non-answer
D) The politician is confidently affirming their consistent record on all matters",B
tscp_pragma_trap_0027,mc,"A person says, 'I love doing laundry,' with no contextual cues suggesting irony. A listener assumes this must be sarcastic because most people dislike laundry. Which principle does the listener's inference violate?","A) The maxim of quality — the listener is assuming the speaker is lying
B) The maxim of relation — the listener assumes the statement is not relevant as stated
C) Both A and B — the listener is both failing charity and implicitly accusing the speaker of deception
D) Charity — the listener is ignoring the possibility that the speaker genuinely means what they say",D
tscp_pragma_trap_0028,mc,"In a formal apology, someone says: 'I'm sorry you feel that way.' This is commonly described as a non-apology. What is the precise pragmatic reason?","A) The statement lacks sincerity markers
B) The statement expresses regret about the other person's emotional state, not about the speaker's action — it does not include any acknowledgment of wrongdoing or responsibility
C) The use of 'feel' trivializes the other person's experience
D) Both B and C contribute to the non-apology quality",D
tscp_pragma_trap_0029,mc,A hiring manager emails a rejected candidate: 'We were very impressed with your credentials and found this decision very difficult.' The candidate interprets this as genuine praise. Is the candidate's interpretation pragmatically well-founded?,"A) Yes — the hiring manager would have no reason to lie about being impressed
B) No — this is a formulaic consolation phrase in rejection letters and carries little informational value
C) Partially — while formulaic, the statement is likely somewhat true since the candidate made it to the final stage
D) The candidate cannot know whether the praise is sincere without knowing whether they were close to being hired",C
tscp_pragma_trap_0030,mc,"A friend says, 'You should try the new Thai place downtown' after asking what you did for lunch and hearing you went there. What has gone wrong in this exchange?","A) The friend is being sarcastic about the Thai place
B) The friend failed to process that you already went there, suggesting the recommendation was prepared without listening
C) The friend's recommendation may be genuine advice delivered without sarcasm — a simple failure to update on your answer
D) Both B and C are plausible — the friend could have genuinely misheard or be giving the recommendation anyway as affirmation",D
