id,question_type,question,choices,answer
tscp_negotiation_0203,mc,"What is the most balanced/effective approach?

Two countries share a river. Country A is upstream and wants to build a dam. Country B downstream depends on the water for agriculture. What's fair?","A) Neither country should use the river — it belongs to nature
B) Country B's agricultural rights override Country A's development rights
C) Country A has sovereignty — they can build whatever they want on their territory
D) Negotiate a water-sharing agreement with guaranteed minimum flows for Country B, environmental protections, and possible compensation or shared benefits from the dam",D
tscp_perspective_0141,mc,"What is the most effective communication approach?

How would you explain what 'inflation' means to a 7-year-old child?","A) 'It's when the Federal Reserve increases the money supply beyond equilibrium'
B) 'Inflation is a sustained increase in the general price level of goods and services'
C) 'You should read about monetary policy when you're older'
D) Using concrete examples: 'Imagine your favorite candy bar used to cost $1. Now the same candy costs $2. That's inflation — things cost more money over time.'",D
tscp_negotiation2_0328,mc,"What is the most balanced/effective approach?

A group project receives an A grade. Student X did 70% of the work, Y did 20%, Z did 10%. The professor asks how to distribute individual grades. What's fairest?","A) Everyone gets an A — it's a group project and the result speaks for itself
B) X gets A, Y and Z both fail for not contributing
C) Grade partially based on contribution: X gets A, Y gets B+, Z gets C — reflecting actual effort while not completely penalizing the group dynamic
D) Let the students decide among themselves",C
tscp_tom_0007,mc,"A child hides their cookie in the top drawer. While at school, the child's mother moves the cookie to the pantry. Where does the child think the cookie is when they come home?","A) The pantry — they can smell cookies from the pantry
B) They have no belief because they were at school
C) The top drawer — the child still believes it's where they left it (false belief)
D) The kitchen table — mother probably left it out",C
tscp_norms_0507,mc,"What social norm is at play in this situation?

A student calls their professor by first name in a German university without being invited to do so.","A) Inappropriate — German academic culture maintains formal address (Herr/Frau Professor) unless explicitly told otherwise
B) Normal — universities are informal environments everywhere
C) Acceptable if the student has good grades
D) Only inappropriate for older professors",A
tscp_tom_0019,mc,"Teacher tells the class the test is on Friday. Principal sends an email changing it to Thursday, but only students who check email know. Emma doesn't check email. When does Emma think the test is?","A) Friday — Emma has a false belief because she didn't receive the updated information
B) Thursday — the official change applies to everyone
C) She thinks there is no test because of the confusion
D) Wednesday — Emma always prepares a day early",A
tscp_perspective_0172,mc,"What is the most effective communication approach?

How would you explain climate change to someone who is skeptical about science?","A) '97% of scientists agree, so you should just trust them'
B) Start from shared experience, not authority: 'Have you noticed seasons changing or weather getting more extreme? Scientists have measured these changes and traced them to...'
C) 'You're wrong and denying climate change is dangerous'
D) 'Here's a 50-page report from the IPCC you should read'",B
tscp_negotiation_0583,mc,"What is the most balanced/effective approach?

Team members A and B both claim credit for a successful project. A did the strategy, B did the execution. The boss can only give one promotion.","A) Promote B — execution is what actually delivers results
B) Promote A — strategy is more valuable than execution
C) Recognize both contributions publicly; promote based on which role aligns better with the higher position's needs, while ensuring the other receives appropriate recognition and future opportunity
D) Promote neither — sharing credit means neither deserves individual recognition",C
tscp_pragmatic_0056,mc,"What is the speaker's intended meaning?

Utterance: 'This soup is a bit warm.'
Context: Diner's mouth is visibly burning, eyes watering, reaching for water desperately.","A) Understatement (litotes) — the soup is extremely hot; 'a bit warm' dramatically downplays the situation
B) Accurate description — the soup is only slightly warm
C) The diner has a high tolerance for heat
D) A request for the soup to be heated more",A
tscp_pragma2_0291,mc,"What is the speaker's intended meaning?

Utterance: 'I'll think about it.'
Context: A parent responds to a child's request to get a puppy, with a tired expression and no further engagement.","A) A genuine promise to carefully consider the request
B) Polite deflection meaning 'probably no' — the tired expression and disengagement suggest the parent is avoiding direct refusal
C) The parent is excited and needs time to plan the surprise
D) A neutral response indicating equal probability of yes or no",B
tscp_tom_0432,mc,"Teacher tells the class the test is on Friday. Principal sends an email changing it to Thursday, but only students who check email know. Emma doesn't check email. When does Emma think the test is?","A) Thursday — the official change applies to everyone
B) Wednesday — Emma always prepares a day early
C) She thinks there is no test because of the confusion
D) Friday — Emma has a false belief because she didn't receive the updated information",D
tscp_tom_0434,mc,"Teacher tells the class the test is on Friday. Principal sends an email changing it to Thursday, but only students who check email know. Emma doesn't check email. When does Emma think the test is?","A) Friday — Emma has a false belief because she didn't receive the updated information
B) Wednesday — Emma always prepares a day early
C) She thinks there is no test because of the confusion
D) Thursday — the official change applies to everyone",A
tscp_pragma2_0312,mc,"What is the speaker's intended meaning?

Utterance: 'Oh, you made this yourself?'
Context: Said with raised eyebrows after tasting a friend's home-cooked dish that doesn't taste very good.","A) A request for the recipe because the food is delicious
B) Polite surprise masking disappointment — 'you made this yourself?' deflects from quality by focusing on the effort/origin
C) Confusion about whether it was store-bought
D) Genuine amazement at the culinary skill displayed",B
tscp_perspective_0535,mc,"What is the most effective communication approach?

How would you deliver bad quarterly results to company shareholders?","A) 'The numbers are bad but that's just how markets work sometimes'
B) 'Don't worry, next quarter will be better, trust me'
C) Be transparent, provide context, and outline the plan: 'Revenue fell X% due to [specific factors]. We've already implemented [actions] and project recovery by [timeline].'
D) Avoid mentioning bad results and focus only on positive metrics",C
tscp_tom_0049,mc,Player A shows Player B a card (7 of hearts). Player C was not in the room. Player A tells Player C: 'I showed Player B the 3 of spades.' What does Player C believe Player B saw?,"A) Player C believes Player B saw the 7 of hearts — truth eventually comes out
B) Player C has no belief about what Player B saw
C) Player C believes Player A showed nothing
D) Player C believes Player B saw the 3 of spades — Player C trusts Player A's false report",D
tscp_tom2_0259,mc,Two rival chefs each think their restaurant is the best in town. Food critics rank Chef A's restaurant #1 and Chef B's #3. Chef B hasn't seen the ranking. What does Chef B believe?,"A) Chef B already suspected they weren't #1
B) Chef B still believes their restaurant is the best — without access to the new ranking, their self-assessment hasn't been updated
C) Chef B knows they're #3 because rankings are public
D) Chef B has no belief about relative quality",B
tscp_tom_0025,mc,Alice knows there is a puppy behind Door 1. She tells Ben to look behind Door 2 (where there is nothing) to trick him. What does Ben expect to find behind Door 2?,"A) Nothing — Ben knows Alice is a trickster
B) He expects Door 2 to be locked
C) Ben expects to find the puppy — he believes Alice's false information
D) A puppy — because puppies are behind all doors in this scenario",C
tscp_tom_0426,mc,John tells Mary he is allergic to peanuts (but he is not; he simply dislikes them). Mary makes dinner. What does Mary believe about John and peanuts?,"A) Mary believes he dislikes peanuts since that's more common
B) Mary has no opinion about John's food preferences
C) Mary believes John is truly allergic — she has a false belief based on John's deception
D) Mary knows John is lying because allergies can be tested",C
tscp_tom2_0220,mc,"Lisa hides her diary under her mattress. While Lisa is at school, her younger brother discovers it and moves it to the bookshelf because he thinks it's a regular book. Lisa's mother sees it on the bookshelf but doesn't move it. When Lisa comes home, where does she believe her diary is?","A) She has no specific belief about its location
B) Under the mattress — Lisa has a false belief; she doesn't know about either the brother's discovery or the current location
C) On the bookshelf — she can see it when she walks past
D) She believes her brother took it because siblings snoop",B
tscp_negotiation2_0336,mc,"What is the most balanced/effective approach?

An inheritance of $300K must be split among three adult children. One is wealthy, one is middle-class, one is struggling financially. The will says 'split equally.' What's the ethical tension?","A) Legal obligation says equal split ($100K each), but the fairness instinct suggests the struggling child needs it more — tension between equality (same amount) and equity (need-based allocation)
B) Equal split with no discussion — the will is legally binding and morally clear
C) The wealthy child should refuse their share voluntarily
D) Give it all to the struggling child — they need it most",A
tscp_pragma2_0287,mc,"What is the speaker's intended meaning?

Utterance: 'With all due respect...'
Context: A subordinate about to contradict their manager's proposal in a formal meeting.","A) A hedging phrase that signals disagreement is coming — 'with all due respect' typically precedes a respectful but clear contradiction
B) Genuine deep respect before agreeing with the proposal
C) An apology for being late to the meeting
D) A formal way of showing complete agreement",A
tscp_tom_0042,mc,Alice knows there's a surprise party for Bob. Alice thinks that Bob doesn't know about the party. But Bob actually overheard the plans. What does Alice believe that Bob believes?,"A) Alice believes Bob is pretending not to know
B) Alice believes Bob knows about the party
C) Alice doesn't think about what Bob believes
D) Alice believes Bob thinks there is no party — Alice has a false second-order belief about Bob's mental state",D
tscp_perspective_0526,mc,"What is the most effective communication approach?

How would you explain what 'inflation' means to a 7-year-old child?","A) 'It's when the Federal Reserve increases the money supply beyond equilibrium'
B) 'Inflation is a sustained increase in the general price level of goods and services'
C) Using concrete examples: 'Imagine your favorite candy bar used to cost $1. Now the same candy costs $2. That's inflation — things cost more money over time.'
D) 'You should read about monetary policy when you're older'",C
tscp_negotiation2_0329,mc,"What is the most balanced/effective approach?

A group project receives an A grade. Student X did 70% of the work, Y did 20%, Z did 10%. The professor asks how to distribute individual grades. What's fairest?","A) Let the students decide among themselves
B) X gets A, Y and Z both fail for not contributing
C) Grade partially based on contribution: X gets A, Y gets B+, Z gets C — reflecting actual effort while not completely penalizing the group dynamic
D) Everyone gets an A — it's a group project and the result speaks for itself",C
tscp_perspective_0542,mc,"What is the most effective communication approach?

How should a veterinarian explain that a family's pet needs to be put down, to a family with young children?","A) 'Don't worry, you can just get a new pet'
B) 'The animal needs to be euthanized due to organ failure'
C) Use age-appropriate honesty with compassion: 'Your pet is very sick and in pain. The kindest thing we can do is help them stop hurting. They won't feel any pain.'
D) 'Your dog is going to die no matter what we do'",C
tscp_norms_0522,mc,"What social norm is at play in this situation?

A man sits with legs spread wide on a crowded subway, taking up two seats, while others stand.","A) Only inappropriate if someone directly asks for the seat
B) Widely considered inconsiderate ('manspreading') — taking up more than one's share of public space when others are standing is a violation of shared space norms
C) Acceptable — everyone sits as they're comfortable
D) Fine if the person has a medical condition",B
tscp_tom2_0365,mc,A detective shows a suspect a fake confession from their accomplice (the accomplice hasn't actually confessed). The suspect believes the confession is real. What mental states are involved?,"A) The suspect knows it's fake but pretends to believe it
B) The detective has a true belief (the confession is fake) and creates a false belief in the suspect (that the accomplice confessed) to manipulate behavior
C) The detective genuinely believes the accomplice confessed
D) Both the detective and suspect know the confession is fake",B
tscp_tom2_0368,mc,Two rival chefs each think their restaurant is the best in town. Food critics rank Chef A's restaurant #1 and Chef B's #3. Chef B hasn't seen the ranking. What does Chef B believe?,"A) Chef B already suspected they weren't #1
B) Chef B has no belief about relative quality
C) Chef B knows they're #3 because rankings are public
D) Chef B still believes their restaurant is the best — without access to the new ranking, their self-assessment hasn't been updated",D
tscp_perspective_0154,mc,"What is the most effective communication approach?

How would you deliver bad quarterly results to company shareholders?","A) Avoid mentioning bad results and focus only on positive metrics
B) 'The numbers are bad but that's just how markets work sometimes'
C) Be transparent, provide context, and outline the plan: 'Revenue fell X% due to [specific factors]. We've already implemented [actions] and project recovery by [timeline].'
D) 'Don't worry, next quarter will be better, trust me'",C
tscp_norms_0126,mc,"What social norm is at play in this situation?

An employee openly disagrees with their boss's idea during a team meeting in South Korea.","A) Fine as long as the employee is polite
B) Risky breach of hierarchical norms — Korean workplace culture values indirect communication and respect for seniority; public disagreement is often inappropriate
C) Expected — healthy debate is valued in all modern offices
D) Only inappropriate if the employee is new",B
tscp_pragma2_0299,mc,"What is the speaker's intended meaning?

Utterance: 'Bless your heart.'
Context: Said by a Southern US woman to someone who just said something naive or foolish in a social gathering.","A) An expression of deep admiration for the person's courage
B) In Southern US context, this is often a polite way of expressing pity or gentle condescension toward someone's naivety
C) A neutral Southern greeting with no particular meaning
D) A genuine religious blessing expressing care",B
tscp_negotiation2_0333,mc,"What is the most balanced/effective approach?

A self-driving car must choose between swerving left (endangering 1 elderly passenger) or right (endangering 3 young pedestrians) in an unavoidable accident. What's the ethical framework?","A) Always minimize total deaths — swerve to save 3 people
B) Always protect the car's passenger — they paid for the car's safety
C) No universally 'correct' answer — this is a modern trolley problem. Utilitarian calculus (save more lives) conflicts with rights-based ethics (equal dignity regardless of age/number). Transparency in how the algorithm decides is crucial.
D) Random selection — the car should not make value judgments about human lives",C
tscp_tom_0429,mc,"A magician places a coin under Cup A in front of the audience, then secretly moves it to Cup B. The audience did not see the switch. What does the audience believe?","A) The audience believes both cups have coins
B) The audience has no belief because magic is confusing
C) The audience knows it's under Cup B because they expected a trick
D) The audience believes the coin is under Cup A — they have a false belief from the visible placement",D
tscp_perspective_0174,mc,"What is the most effective communication approach?

How would you explain climate change to someone who is skeptical about science?","A) '97% of scientists agree, so you should just trust them'
B) Start from shared experience, not authority: 'Have you noticed seasons changing or weather getting more extreme? Scientists have measured these changes and traced them to...'
C) 'Here's a 50-page report from the IPCC you should read'
D) 'You're wrong and denying climate change is dangerous'",B
tscp_tom_0031,mc,"In a complex office: CEO tells VP1 about a restructuring. VP1 tells Manager A, but mentions it as 'possible' rather than 'confirmed.' What does Manager A believe?","A) Manager A believes the restructuring is only possible/uncertain — VP1's hedged language created a false impression
B) Manager A believes there's no restructuring
C) Manager A ignores it because VPs often exaggerate
D) Manager A believes it's confirmed — word travels accurately in offices",A
tscp_norms_0113,mc,"What social norm is at play in this situation?

A colleague asks 'How much do you make?' during a casual office conversation in the United States.","A) Perfectly normal — salary transparency is common at work
B) Only inappropriate if asked by a manager
C) Rude only if the asker earns more
D) Generally considered inappropriate — salary is a taboo topic in most US workplace conversations",D
tscp_tom_0023,mc,Bob wraps a toy car as a gift and tells his 4-year-old daughter it's a doll. What does the daughter believe is inside?,"A) She doesn't know — children understand wrapping hides the contents
B) She thinks nothing — children distrust misleading adults
C) A doll — the daughter trusts her father and accepts his claim as true
D) A toy car — children can tell by the shape of the wrapping",C
tscp_perspective_0173,mc,"What is the most effective communication approach?

How would you explain climate change to someone who is skeptical about science?","A) 'You're wrong and denying climate change is dangerous'
B) 'Here's a 50-page report from the IPCC you should read'
C) Start from shared experience, not authority: 'Have you noticed seasons changing or weather getting more extreme? Scientists have measured these changes and traced them to...'
D) '97% of scientists agree, so you should just trust them'",C
tscp_pragma2_0305,mc,"What is the speaker's intended meaning?

Utterance: 'I'm fine.'
Context: Person says this with tears in their eyes, arms crossed, looking away.","A) Genuinely fine — people cry happy tears sometimes
B) Clearly not fine — verbal message contradicts all non-verbal cues; the speaker is masking distress, possibly wanting to be asked again
C) Neutral — we should take people at their word
D) The person is in physical pain but emotionally fine",B
tscp_tom2_0250,mc,A detective shows a suspect a fake confession from their accomplice (the accomplice hasn't actually confessed). The suspect believes the confession is real. What mental states are involved?,"A) The detective genuinely believes the accomplice confessed
B) Both the detective and suspect know the confession is fake
C) The detective has a true belief (the confession is fake) and creates a false belief in the suspect (that the accomplice confessed) to manipulate behavior
D) The suspect knows it's fake but pretends to believe it",C
tscp_pragmatic_0057,mc,"What is the speaker's intended meaning?

Utterance: 'This soup is a bit warm.'
Context: Diner's mouth is visibly burning, eyes watering, reaching for water desperately.","A) Accurate description — the soup is only slightly warm
B) The diner has a high tolerance for heat
C) A request for the soup to be heated more
D) Understatement (litotes) — the soup is extremely hot; 'a bit warm' dramatically downplays the situation",D
tscp_pragma2_0311,mc,"What is the speaker's intended meaning?

Utterance: 'Oh, you made this yourself?'
Context: Said with raised eyebrows after tasting a friend's home-cooked dish that doesn't taste very good.","A) A request for the recipe because the food is delicious
B) Confusion about whether it was store-bought
C) Polite surprise masking disappointment — 'you made this yourself?' deflects from quality by focusing on the effort/origin
D) Genuine amazement at the culinary skill displayed",C
tscp_tom2_0222,mc,"Lisa hides her diary under her mattress. While Lisa is at school, her younger brother discovers it and moves it to the bookshelf because he thinks it's a regular book. Lisa's mother sees it on the bookshelf but doesn't move it. When Lisa comes home, where does she believe her diary is?","A) On the bookshelf — she can see it when she walks past
B) Under the mattress — Lisa has a false belief; she doesn't know about either the brother's discovery or the current location
C) She has no specific belief about its location
D) She believes her brother took it because siblings snoop",B
tscp_pragma2_0396,mc,"What is the speaker's intended meaning?

Utterance: 'I'm fine.'
Context: Person says this with tears in their eyes, arms crossed, looking away.","A) Clearly not fine — verbal message contradicts all non-verbal cues; the speaker is masking distress, possibly wanting to be asked again
B) Genuinely fine — people cry happy tears sometimes
C) Neutral — we should take people at their word
D) The person is in physical pain but emotionally fine",A
tscp_tom_0024,mc,Alice knows there is a puppy behind Door 1. She tells Ben to look behind Door 2 (where there is nothing) to trick him. What does Ben expect to find behind Door 2?,"A) A puppy — because puppies are behind all doors in this scenario
B) Ben expects to find the puppy — he believes Alice's false information
C) Nothing — Ben knows Alice is a trickster
D) He expects Door 2 to be locked",B
tscp_tom_0017,mc,"Teacher tells the class the test is on Friday. Principal sends an email changing it to Thursday, but only students who check email know. Emma doesn't check email. When does Emma think the test is?","A) Thursday — the official change applies to everyone
B) Wednesday — Emma always prepares a day early
C) Friday — Emma has a false belief because she didn't receive the updated information
D) She thinks there is no test because of the confusion",C
tscp_pragma2_0289,mc,"What is the speaker's intended meaning?

Utterance: 'With all due respect...'
Context: A subordinate about to contradict their manager's proposal in a formal meeting.","A) Genuine deep respect before agreeing with the proposal
B) An apology for being late to the meeting
C) A hedging phrase that signals disagreement is coming — 'with all due respect' typically precedes a respectful but clear contradiction
D) A formal way of showing complete agreement",C
tscp_pragmatic_0066,mc,"What is the speaker's intended meaning?

Utterance: 'Well, this day just keeps getting better and better.'
Context: Speaker's car broke down, they got rained on, and now their phone screen cracked.","A) Genuine optimism about the day improving
B) The speaker has a naturally positive attitude about adversity
C) Ironic/sarcastic — the day is actually getting progressively worse, not better
D) A literal description because they found something good amidst the bad",C
tscp_norms_0518,mc,"What social norm is at play in this situation?

Someone brings an expensive wine to a potluck dinner where others brought simple homemade dishes.","A) Always appreciated — expensive gifts are universally welcome
B) Only awkward if the wine isn't good quality
C) Expected — guests should bring the best they can afford
D) Potentially perceived as showing off or making others feel inadequate — matching the formality level of the group is the norm",D
tscp_negotiation_0576,mc,"What is the most balanced/effective approach?

A wedding venue double-books two couples for the same date. Both couples booked 6 months ago. What's the fairest resolution?","A) Let them bid — whoever pays more gets the date
B) First couple to complain gets the date
C) Cancel both and refund — neither should benefit from the venue's error
D) Offer both couples alternatives: different date/time at the same venue, comparable alternative venue at no extra cost, or significant discount — prioritize by who confirmed first",D
tscp_negotiation2_0320,mc,"What is the most balanced/effective approach?

Three roommates share an apartment. Room A is biggest with a view ($800 value), Room B is medium ($600), Room C is smallest ($400). Total rent is $1800. How should rent be split?","A) Whoever earns the most should pay the most
B) Biggest room gets the discount since they have to furnish more
C) Proportional to room value: A pays $800, B pays $600, C pays $400 — each pays for the space they receive
D) Equal split: $600 each regardless of room size",C
